{
  "$schema": "https://json-schema.org/draft/2020-12/schema",
  "$id": "https://thesispulse.ai/contracts/v1/fill-event.schema.json",
  "title": "ThesisPulse AI Fill Event v1",
  "type": "object",
  "additionalProperties": false,
  "required": [
    "contract_version",
    "message_id",
    "correlation_id",
    "causation_id",
    "environment",
    "source_service",
    "source_version",
    "generated_at_utc",
    "fill_event_id",
    "order_id",
    "execution_command_id",
    "trade_plan_id",
    "broker_account_id",
    "instrument_id",
    "side",
    "fill_qty",
    "fill_price",
    "currency",
    "fill_at_utc",
    "received_at_utc"
  ],
  "properties": {
    "contract_version": {"type": "string", "const": "1.0.0"},
    "message_id": {"type": "string", "format": "uuid"},
    "correlation_id": {"type": "string", "format": "uuid"},
    "causation_id": {"type": ["string", "null"], "format": "uuid"},
    "environment": {"type": "string", "enum": ["PAPER", "SHADOW", "LIVE"]},
    "source_service": {"type": "string", "minLength": 1, "maxLength": 100},
    "source_version": {"type": "string", "minLength": 1, "maxLength": 50},
    "generated_at_utc": {"type": "string", "format": "date-time"},
    "fill_event_id": {"type": "string", "format": "uuid"},
    "order_id": {"type": "string", "format": "uuid"},
    "execution_command_id": {"type": "string", "format": "uuid"},
    "trade_plan_id": {"type": "string", "format": "uuid"},
    "broker_account_id": {"type": "string", "minLength": 1, "maxLength": 100},
    "broker_order_id": {"type": ["string", "null"], "maxLength": 200},
    "broker_fill_id": {"type": ["string", "null"], "maxLength": 200},
    "fill_fingerprint": {"type": ["string", "null"], "maxLength": 256},
    "instrument_id": {"type": "string", "minLength": 1, "maxLength": 100},
    "side": {"type": "string", "enum": ["BUY", "SELL"]},
    "fill_qty": {"type": "number", "exclusiveMinimum": 0},
    "fill_price": {"type": "number", "exclusiveMinimum": 0},
    "gross_amount": {"type": ["number", "null"], "minimum": 0},
    "fees_amount": {"type": ["number", "null"], "minimum": 0},
    "taxes_amount": {"type": ["number", "null"], "minimum": 0},
    "net_amount": {"type": ["number", "null"]},
    "currency": {"type": "string", "pattern": "^[A-Z]{3}$"},
    "liquidity_role": {"type": ["string", "null"], "enum": ["MAKER", "TAKER", "UNKNOWN", null]},
    "fill_at_utc": {"type": "string", "format": "date-time"},
    "received_at_utc": {"type": "string", "format": "date-time"},
    "broker_sequence": {"type": ["string", "integer", "null"]},
    "settlement_date": {"type": ["string", "null"], "format": "date"},
    "is_reconciliation_fill": {"type": "boolean", "default": false},
    "metadata": {"type": "object", "additionalProperties": true}
  },
  "anyOf": [
    {
      "required": ["broker_fill_id"],
      "properties": {"broker_fill_id": {"type": "string", "minLength": 1}}
    },
    {
      "required": ["fill_fingerprint"],
      "properties": {"fill_fingerprint": {"type": "string", "minLength": 1}}
    }
  ]
}
