{
  "contract_version": "1.0.0",
  "message_id": "99999999-9999-4999-8999-999999999999",
  "correlation_id": "22222222-2222-4222-8222-222222222222",
  "causation_id": "aaaaaaaa-aaaa-4aaa-8aaa-aaaaaaaaaaaa",
  "environment": "PAPER",
  "source_service": "execution-service",
  "source_version": "1.0.0",
  "generated_at_utc": "2026-06-29T09:20:05Z",
  "fill_event_id": "bbbbbbbb-bbbb-4bbb-8bbb-bbbbbbbbbbbb",
  "order_id": "cccccccc-cccc-4ccc-8ccc-cccccccccccc",
  "execution_command_id": "77777777-7777-4777-8777-777777777777",
  "trade_plan_id": "88888888-8888-4888-8888-888888888888",
  "broker_account_id": "paper-account-1",
  "broker_order_id": "PAPER-BROKER-1",
  "broker_fill_id": "PAPER-FILL-1",
  "fill_fingerprint": null,
  "instrument_id": "NSE_EQ_RELIANCE",
  "side": "BUY",
  "fill_qty": 1,
  "fill_price": 1499.5,
  "gross_amount": 1499.5,
  "fees_amount": 1.0,
  "taxes_amount": 0.5,
  "net_amount": 1501.0,
  "currency": "INR",
  "liquidity_role": "UNKNOWN",
  "fill_at_utc": "2026-06-29T09:20:04Z",
  "received_at_utc": "2026-06-29T09:20:05Z",
  "broker_sequence": "1",
  "settlement_date": null,
  "is_reconciliation_fill": false,
  "metadata": {}
}
